X,subject_name,talk_block,object_name,description,cosineSim,accuracyScaled
68,tulip005,1,pocketradio,Um typically made… it’s like a rectangular shape or it has like it comes in on the bottom it has like these wire like like a mesh type of situation where like the audio comes out of sometimes it has like a little antenna on it that like pokes out from the top very small like a fit in your hand I think you can like there has like like knobs that you can turn for like different stations it essentially picks up like radio waves from different stations you turn the knob left or right to like change the radio station it plays whatever is on the radio at the time there's like an AM setting there's usually an FM setting just like a volume setting you can essentially just listen to the radio it's very tiny like in the travel size you can take it with you,0.139388949690746,0.31692401154144
287,tulip016,1,rolodex,"Rolodex. I am familiar with the word. Rolodex is a. This is sort of an older device.  What it looks like from what I think it is, is a. It's a. A metal wheel. It's a. It's a metal stainless steel stand that makes a triangle shape. And there are two metal triangles that hold up a metal rod.  And of the metal rod, there are pieces of paper, small rectangles with personal information written on them. And a Rolodex is made up of an alphabetical order of. People's personal information. So it's just a bunch of papers ordered next to each other in alphabetical order. There is a sort of hand crank to rotate these papers typically. Okay. So a Rolodex is used to. It's sort of like what you would see in a book. It's like a. A. A list of everyone's personal information that you know. It's a way to. It's a way to have a. A person's. Information. It's an older way to get.  Look up people's information, but it's typically used. I've seen it used in movies for office settings. When.  You're trying to look up someone's information, you'll.  You'll see them go through their Rolodex and they'll say, yes, I found this card for this one person's information. It typically has a name and address. Maybe their relation to you. And they're just a list of people's personal information. Okay.",0.442067709388747,0.703073739638807
431,tulip024,1,rolodex," I think it's like a small little thing where you can flip through, I believe, small little files or something. Okay. I think it just shows you little names of files or something. I'm not completely sure.",0.310325580789285,0.535000541544536
134,tulip009,1,rolodex," Um, I haven't heard of this object before. I'm not really sure. Rolodex. The first thing that came to mind was like Rolex because it's a similar word.  Um, but I don't know. Maybe it's like a game of some sorts or something. Or something you can use in a game.  Um, I imagine Rolodex is like, yeah, like I said, like maybe something you can use in a game or some kind of like card playing game. But I'm not sure. I haven't heard of this.",0.286665125519089,0.504815145058962
262,tulip015,1,rolodex," Um, I never heard about this object before, so I think it's like probably made of wood? I don't know. Or steel? Or some hard materials?  Um, I think, I think it's like, it's used to, um, putting something inside?  I don't know, I never, I never heard of this object before.",-0.0218213205433116,0.111256121004636
132,tulip008,1,rolodex,I'm not sure what it looks like or what it's made of. I'm also not sure what it's used for and how it works.,0.00748984979035955,0.148650553523971
38,tulip004,1,rolodex,I personally do not have a lot of experience with this item. I don’t know what it is and I would say I don’t have a guess either.Bases on my last  item I also would not say that I do not know how this item is used or what it is used for.,0.00960501677450188,0.151349028820427
416,tulip022,1,shoehorn,This object is typically longer and skinny with a handle at the top potentially made out of plastic. It’s usually curved at the edges with a sort of knock for heels to fit in. It’s typically longer to avoid having to pin down for application uses. This object is used for um easier application for putting shoes on. It’s typically placed at the back of the shoe at the heel where you can use the knock in the tool to slide your heel in the shoes for easier foot insertion.,0.540704607803272,0.828912141848263
54,tulip005,1,shoehorn," It's typically just a long piece, like sometimes it's wood, sometimes it's metal. It has like an indentation in it for like where your ankle goes. It's used to assist in putting on shoes.  While you're putting on shoes, you place it against your heel. And put the shoe on how you normally would just put it in the shoe. It just helps not crease like if it's leather or anything. Also it just helps slide the ankle in.",0.503463974176326,0.781401505279093
136,tulip009,1,shoehorn," A shoehorn is, it's usually made out of wood or sometimes it can be like plastic and I think it's like almost like a stretcher that you put into  A shoe, I'm thinking like more so like heels that like need to be like stretched out more like or any leather shoes to either keep them in place or to help with like making them comfortable and stretching them out and I've seen them in like wood or plastic variations. So a shoehorn is basically insert it into a shoe. And Some of them are like adjustable so you can like turn the knob depending on like if you want to make it like more narrower or bigger depending on like the shoe if you need to have it stretched out.  And I've seen people use them, like I said, like in like heels and stuff like that for just like making them more comfortable and stretching the leather out.",0.501399854953427,0.778768155395282
310,tulip017,1,shoehorn,I don't know. I don't know.,0.00695538880428386,0.147968702030137
280,tulip015,1,shoehorn,I think for this one it's made of plastic and I don't think that it's like a heavy thing and I think it's probably pretty long or something. I think it's used for fixing shoes.,0.055067747104038,0.209349203569492
100,tulip007,1,shoehorn,Not too sure what this is. Likely made of plastic since it's probably gonna be close to human contact so likely to help you wear your shoes easier so you don't have to like bend down too much and like hurt your back or something.,0.163058072334237,0.347120465637548
26,tulip004,1,stethoscope,A stethoscope is something that usually goes around a doctor's neck and it's kind of like a longer shape and it has two parts that go into a person's ear and then the other part is like a silver part at the end that's placed on a person's heart and that typically listens to the person's heartbeat. When this object is used it goes in someone's ears like I said there's two parts and then the bottom part at the end is placed on a person's heart and it listens to their heartbeat to see if they have any regular or irregular heart.,0.486098342700695,0.759246882076446
114,tulip008,1,stethoscope,the object looks like two plugs that go into your ears with wires hanging down. They sit around your chest and join together. From there there's this one tube connected to some sort of thing that will amplify the sound in your heart. The object works by amplifying the sound in your heart and you're able to see or hear your heartbeat.,0.470029270869975,0.738746376112959
146,tulip009,1,stethoscope,"Stethoscope.  I want to say it's the thing that doctors wear around their necks that has, it's like a necklace cut and they plug it into their ears too so it looks like earbuds.  And it's like a longer side on like, longer side at the end of it where it has a metal portion and yeah it looks like your stereotypical doctor's stethoscope. It is used to check heartbeat in patients. That's what doctors use it for. So they put it into their ears. Not exactly sure how it works but I do know they like put it into their ears and then the metal portion goes on the patient's chest and then they have them breathe in and out and then they can hear the heartbeat I think.",0.455362666600756,0.720035101967653
276,tulip015,1,stethoscope," I think for this one, I think it looks pretty small.  And also like, but I'm not sure for what specific it looks like. I think it probably has some lines on it.  And for this one, I think it's for testing anything, like to detect anything like in the dark or on the water.  Um, because I never see this before.",0.017749500377118,0.161739550216053
366,tulip020,1,stethoscope,looks like a little looks like a rubber rope and it has one end has a circle I'm thinking of the right thing of metal and it's flat but has like a 3d dimension of so you can hold on to it but it's not the front half is flat and it connects to the rest of them where the other end has two outward things this is what doctors use when they check people's heartbeats I think and to see if,0.06511627612393,0.222168856830531
108,tulip007,1,stethoscope,"It should be mostly made of metal and then it's like something that you can put over your ears and then a thing to listen to.  It’s likely used to listen to heartbeats, doctors use it a lot to hear how fast a patient's heart rate might be.",0.260057062992197,0.470869267521309
152,tulip009,1,threeholepunch," So this object, three hole punch, it looks like, so it's like a long metal piece usually. Like I remember like the ones we used to have in like our elementary school classrooms. It was like a long metal piece and it was rectangular and it had like two sides and there on one side was the actual hole punching side. So you had like the three holes that would line up to a standard like printer piece of paper and then you'd press down on the opposite side and it would hole punch the paper and then there was like a little tray underneath where it collected all the pieces and you had to empty it out. So this object is used for hole punching paper to make it easier to put into like binders  or like some kind of like, yeah, mostly like binders or like filing systems that like require  binders, but you basically push the piece down and it hole punches, push the opposite piece down and it hole punches the sides.",0.59222386224047,0.894639073307056
329,tulip018,1,threeholepunch,"Okay a three hole punch typically looks like its like a long rectangular shape with three holes, one on one end one in the middle and one on the other end. And it’s typically made of metal too. It’s kind of, it has a base to it and then the top half where you click the top to punch the holes in the paper. And typically how it works is that if you click down on something, on the paper then the holes punch out and then what it’s used for is to punch out holes in a paper so that you can put it in a binder.",0.552805318914082,0.844349915909073
289,tulip016,1,threeholepunch," Okay, so a three-hole punch is a rectangular object. It is longer than the length of a typical printer paper. I'd say it's typically about a foot and a couple of inches longer.  Wait, no, no, no, no, no. That's incorrect. It is longer than the length of printer paper. That's true.  It's typically made of two metal, two rectangular pieces of metal. All of the hole punchers that I've seen have had the color black.  And then on the inside, there is a section for you to, there is a section to line up paper. And then there are three metal prongs. And there is a spring mechanism inside of the two metal bars so that the two metal bars are permanently at an angle so that the bars are only touching on one side that is the long length side. Okay.  So a three-hole punch, three-hole punch tool is used to punch three holes into paper.  People do this for school or for work or for just organizing papers that they have for binders, typically. Or some a sort of a folder that has prongs in it for you to put paper into to store. So you would insert paper into the three-hole punch. And then you would press down on the top metal bar and you would hear a crunch. And that would be the three prongs punching three holes into the paper of a standardized size. Okay. That fits majority of binders.  And so you would just put in some papers, maybe put in a stack of papers, punch the hole, and then you would use the papers for the binder or whatever you're putting your papers into. Okay.",0.541340890082992,0.829723894313326
18,tulip003,1,threeholepunch,This object is usually made out of metal and it shapes like a rod. It is typically used for gardening and it can help you plant stuff.,0.0487418756604134,0.201278820499428
451,tulip024,1,threeholepunch,it is like it's its length is about the size of a piece of paper like like 18 inches I think and there's three three little things that you can put the paper into to hole punch it it's like sharp sharp circular thing and there's springs you just like press the side of it to lift the springs up and then release it and like the pressure is enough to use the sharp parts of it to cut the paper and hole punch it so you can like put it in a binder or something it works by the springs make enough pressure to that the little sharp things can cut through paper really easily and it's so you can have three holes in the paper to attach a bunch of papers together,0.288798713244747,0.507537121060702
424,tulip023,1,threeholepunch,"Um I’m not entirely sure what this is but I’m presuming it’s just like a hole puncher for paper. Um which is typically made out of either plastic or like a mix of plastic metal. There’s like a metal kind of like ruler with a bent edge that like allows you to place the holes in like the center of the paper. Um there’s these two or in this case like 3 blades. Um they’re kind of slanted and eventually when pressure is placed on the lever of like the object it allows it to cut through paper and create holes. Um the object itself has like springs and is like rectangular and kind of looks like an angle of sort, like a triangle without the last line if that makes sense? And then there’s that lever at the very top and then the three holes, the three like hold blades. And the edge is kind of like a sandwich so there’s like a plastic base attached to the metal rod I mentioned before and then the blade’s inside. And then on top of the blades the plastic handle or lever which you push down to use. Um the object is used to create holes in paper which can then be used for like storage purposes or keeping in a binder. Um and it can be used for crafts um but usually is more like an office, something you’d typically find in an office um. Yeah.",0.295882463244753,0.516574385978601