X,subject_name,talk_block,object_name,description,cosineSim,accuracyScaled
339,tulip019,1,bloodpressurecuff,"Uh blood pressure cuff I’m assuming it’s the plastic wrap you wrap around your arm to take the blood pressure so it would have a comfortable in line I guess so when it wraps around your arm it doesn’t really bother you. I would assume it has some velcro straps and some wording on the side maybe directions how to use it or apply it to better read your blood pressure. It might be attached to like a plastic tube with like a maybe a little ball you could squish and it just puts pressure on your arm and so it could take your blood pressure. How this object works, like I was saying there might be a ball you squeeze and the blood pressure cuff just adds pressure on your arm. It is used to track your blood pressure to see if you’re healthy or not, and just to assess your health I think um and it’s mainly used for EMTs or like hospitals and yeah it’s just a good way to like assess your health",0.62828134708444,0.940640279279574
202,tulip011,1,bloodpressurecuff,The blood pressure cuff looks like a cuff or a bracelet that you put in either your wrist or your upper arm to check pressure and it has like a little reader device on top which displays numbers. This object works for checking the pressure and it is used in the medical field to check if you have like high or low pressure.,0.542201104293909,0.830821333340704
302,tulip017,1,bloodpressurecuff,A blood pressure cuff is made out of plastic and it's kind of like a wrap that goes around your bicep to check the pressure of your blood and how much your heartbeats are it's made out of plastic and it wraps around your bicep or right below your bicep kind of where your elbow is to check for your heartbeats and the pressure of your blood,0.532629250531967,0.818609810037089
270,tulip015,1,bloodpressurecuff,I think this one is pretty... It's like made of hard materials and can like... with some... used like electronic. For this one I think it's useful to like to let people to put their arms in and to test their blood pressure.,-0.0910268721831131,0.0229654693077637
112,tulip008,1,bloodpressurecuff,"I'm going to say it's black with a band that goes around your arm. And I think it's made of some sort of plastic or fabric.  The object works by, I believe it's pumping air into the place that stores it.  And I'm not sure how it does this, but I think it figures out what the pressure is  by resisting what's inside of your arm, the pressure inside your arm.",0.13802480628942,0.315183672694958
8,tulip003,1,bloodpressurecuff,This us usually made out of some sort of Fabric that has stuff in it and it's usually a long rectangular length so it could wrap around your arm uh this is wrap around your arm and it's used to help measure your blood pressure,0.228649939272461,0.430800871916684
282,tulip016,1,bulbplanter," Okay, so I don't know what a bulb planter is. I'm assuming it has to be a metal tool of some sort where you can dig a hole to plant a bulb of some plant.  I don't actually know what that tool looks like or what it is, so I'd love to actually look at it and learn more. That's everything that I think it could be. The only bulb other option would be a light bulb.  That doesn't make any sense, so it has to be some sort of tool or object. I'm picturing something that's like trowel-shaped. That's anything I can think of.  Right, so I think that this object has to dig holes. In the ground to plant this bulb of something.  I know you can plant bulbs for certain plants, so maybe this was made specifically for a certain type of plant to dig a hole in the ground for.",0.463967605660104,0.731013060518087
124,tulip008,1,bulbplanter,"This object… I'm not sure how this works.  I know this object is used to plant bulbs, which are, I think they’re perennials?  And so, they'll die over the winter but they'll come back during the spring and summer.",0.373371777965948,0.61543324822548
40,tulip004,1,bulbplanter,"I'm not 100% sure what this object would look like but I guess the first thing that comes to my mind is like when I think of planter,   I kind of think of gardening and when I think of bulb, like I think of an onion bulb. So, maybe it's something that like grows something at the start before it's like transferred into like a planter or something to garden with.  So, maybe it would be made out of like plastic and you would have to put like soil in it. I think it's something that I would imagine that it would be used in the beginning stages before they have to be like transplanted or transferred out as they get bigger.",0.330622433708963,0.56089474120356
268,tulip015,1,bulbplanter," For this one, I think it's also made of hard materials  and it's probably looks like,  it's probably round or it looks like a circle or something, look like a ball. I'm not sure about that.  For this one, I think it's probably made to,  like, make people to use it to put on a light bulb. Um.",-0.0333169933289144,0.0965902391803355
439,tulip024,1,bulbplanter,I don't think I know what this is but I'm assuming it's like the part of a lamp where the light bulb screws into and it's like a little metal screw thing with like eight or so notches to screw into. I think it works by just connecting the like metal from the light bulb to the lamp which is connected to electricity.,-0.0290411821680232,0.102045208398596
142,tulip009,1,bulbplanter,"I'm assuming if it is that top part of the metal thing then it works to hold the light  bulb to the actual, to hold the light bulb like in place and to be able to screw it on to places.",0.0144895828111218,0.157580631754165
212,tulip012,1,crankflashlight," The crank flashlight is, I'm assuming smaller torches that you get where you move a lever  around a, move a lever around a centre and it kind of generates kinetic energy which keeps the light  going. I think it's made from like plastic, metal, an LED bulb and so on. And it works by cranking the lever around and this generates the energy to keep the LED bulb going and I think it's used for  well it's used for light but it's not, you can't just turn on and off the switch, it's actually you have to have the continuous motion to do it.",0.532592432051076,0.818562837972054
296,tulip017,1,crankflashlight,I think is a very very bright flashlight probably used for camping I think that's a really really bright flashlight that is yeah again used for camping or to see really really dark areas around for like an unfamiliar areas,0.451754133535262,0.715431428873905
322,tulip018,1,crankflashlight," Okay, I think a crank flashlight might look like, it might be like a cylinder, and I'm  assuming that a cylinder with like a flatter surface, so, and it has like light coming  out of it for like how a normal flashlight works, and I think that it might be made out  of, um, I'm not really sure what it's made out of, but, yeah, I'm not really sure what it's made out of.  And I think how it works is that a crank, like, so it might be like a lever type, like  how the mixer was, and I think that based off of that, like the light comes out, and using that mechanism.  You can have light, and it's probably used for like, um, used to look, used to provide  light for like in dark areas, and like when people are out, it's like an emergency tool almost.",0.429867749442032,0.687509346481774
14,tulip003,1,crankflashlight,This is typically made out of metal and it's a long cylinder shape. You will have to twist the end of it to adjust the light.,-0.0053327757617916,0.132291779702518
106,tulip007,1,crankflashlight,So I'm guessing that it's probably has a handle on the side uh holding the flashlight or maybe Mostly made of metal or mostly made of plastic I'm guessing that it might be like a handheld uh Manual type of flashlight where you have to like spin the thing or like spin the handle,0.142366207566598,0.320722320086061
443,tulip024,1,crankflashlight,It is like a cylindrical object with a crank and like a little I think it's like a little mirror type thing towards the end you crank the flashlight I think like you cranking it creates some energy to I don't know what's inside of it but it uses the energy to make light that people used to see in the dark,0.241844454407981,0.447634092843853
349,tulip019,1,fishingreel,"A fishing reel it is going to be another manual mechanism that fishers use to fish. It is connected  by a very long, very long strings. Those strings are definitely like either made of metal or like really hard like plastic that are made to be in the water  and once you you use the spring, the fishing reel, then when you do get a catch and basically all the the line extends all the way as much as you need or as long as it has or however long it is and once you do get a catch you rotate this the wheel counterclockwise and it just rolls back into the roll and the fishing reel and yeah there's also a crank it is definitely for part attached to a fishing rod. How the object works and what it's used for is for Fishing it is attached to a fishing rod so that real fishing reel is the main part of the fishing rod and because it is attached to all the string that you you need when you fish and when you do catch eat that string just brings back the fish whichever once you rotate it the counterclockwise. Uhm",0.590995051995997,0.893071388999575
370,tulip020,1,fishingreel,"A fishing reel is made up of plastic. and has the reel and rod. The reel might be the thing at the bottom of a fishing rod. Where it's actually probably metal and it holds...  It's like a claw in a way, I think. Reel. It's either the claw at the bottom of a fishing rod or it's the reel. Reel. Or it's the string that holds against the rod. I don't know. I think that it works by you... Something with fishing and helping it not break the rod. When you're reeling...  Oh, the fishing reel is the rotating part that helps you bring the fish in. Yeah. That's what it's called. It's the rotating crank that reels the fish in when you're fishing. Okay. Yep.",0.583128477864172,0.883035417314304
150,tulip009,1,fishingreel,"A fishing reel is... I'm assuming the long portion of a fishing rod.  So it's typically made out of plastic, I think?  Or maybe metal, and it's like a long piece and it has the fishing string going through it, too. So it's used for fishing. And... It... It's like the...  It passes through the fishing rod and the string does, and so that way it can catch the fish and you can reel it back in that way.",0.55565214546765,0.847981823548372
90,tulip007,1,fishingreel,Not really sure what this is but probably likely made of metal since it likely needs to go under water or it is also likely that it's made of some form of plastic. It is likely used to help fish. I mean yeah.,0.154698980564698,0.336456152696762
84,tulip006,1,fishingreel,um made of plastic um fishing reels made of plastic I'm assuming if I even know what that is um and I guess if we're talking about like how it comes in it's like wrapped around um like a tube thing I don't know how you describe it um that holds it it's like a tube and then there's like things on the end to make sure it doesn't fall off and it's wrapped around that and fishing reel specifically is um like a usually clear I think um plastic string um looks like made of yeah long long piece of string plastic string um I mean specifically specifically for fishing um it's used on a fishing pole um and it's like attached to the pole and how does it work and what is it used for work I mean it's used as um I guess to connect the fishing pole to the fishing hook um and the whole point of it is that um you can reel in the hook from the fishing pole um it's used for fishing um I guess you can also use it for just tying anything in general um yeah cool,0.248535420749987,0.456170254536375
190,tulip011,1,fishingreel,"I think a fishing reel looks like a metal square kinda with a little wheel like on the side and a handle. So you can hold the handle and kinda like roll it around to bring the strength that you fish with.  How this object works, you place your hand on the handle and then you roll it back or forth depending on where you want  the string, I can't remember how it's called, with the one you fish.",0.296337089636359,0.517154386562983
227,tulip013,1,floppydisk," Floppy disk is typically made out by plastic and disk inside, like a CD record inside.  And I think there's like, how do we say, kind of like shifting bar to like let it read or  not, I believe.  And yeah, you can really  Think of the USB and the, yeah, USB and kind of like old version of the CD.  So, this floppy disk is out having like two major components, I will say. Mainly,  It's wrapped with the plastic. Some of them might be clear and colorful. And the inside is made up with a CD-shaped disk to read the data inside. And the purpose of the floppy disk is storing the data and transport it.",0.512211507552359,0.79256138196832
254,tulip014,1,floppydisk,"The floppy disk is a plastic cartridge. I think they're more rectangular. My dad would kill me for not knowing this.  If not, they're circular, but I'm pretty sure they're round.  Plastic, thin, yeah. The object is a method of storage. It is an outdated USB.  It is inserted into computers, older computers, I should say. There's not really any use for floppy disks anymore. There just has been a lot of technological advancements.  But at the time when they were used,  you would insert it into the computer, into the designated,  the designated port, and it was used as a hard drive.  But without, you know, an external hard drive, I should say, because it was able to be removed and inserted into other computers.",0.505850819287301,0.784446580498553
335,tulip019,1,floppydisk,"I'm assuming it's like a disk for either like something you put in like a PC or like a sort of memory card thing.  So I'll describe it to be either really small or compact, maybe circle, like in a circle, like a regular CD.  But I'm not sure if it's actually that, but I would assume it's, you know, circle, like look like a CD or either like an SD card.  And yeah, for a PC or laptop.  I think this, oh, this object is used for to either maintain storage or to play a sort of video. Okay.  Whichever is, whichever, so whoever programs it and just what it's used for. I could have a lot of different things. It could probably be for to upload a video or game or anything or to update something in a manual software. But that's what I think what I would say.",0.438182830909635,0.698117512218366
274,tulip015,1,floppydisk," For this one, I think that it's It's probably like pretty long and made of hard materials.  I never seen these things before, so I'm not sure about that.  Um, I think it's used for like, like mixing things.  Um, I'm not sure.",0.0305580604510888,0.178080379664467
414,tulip022,1,floppydisk,"I'm unsure what the object is typically made of but I would think that it is typically circular in shape, potentially made out of plastic or some sort of metal material. Not sure how this object works or what it made be used for aside from maybe storing information.",0.0629460524630162,0.219400141650753
22,tulip003,1,floppydisk,This object is really made out of metal. It's in a circular shape like a CD. This object is like similar to a CD.,0.0903352133319839,0.254342524237887
384,tulip021,1,frenchpress,Typically a French press is a glass container that has lines on the side to tell you how much coffee you are putting in it. It has a lid that you push down to separate the coffee grounds. It's a glass container that you make coffee in. You put coffee grounds at the bottom. You put hot boiling water on top of the coffee grounds. You fill it up to however much coffee you want. You put the lid on. You press the lid down to the surface of the coffee. And then after two minutes you're able to press it all the way down and get your coffee.,0.674809740959543,1
162,tulip010,1,frenchpress," French press looks, well it's made of typically like glass but like rubber handle, like plastic rubber handle. And also has a  It has like a, almost like a siphoning type of thing that goes on top and like a little metal rod that goes through that so you can push and press down coffee.  It's used for making coffee, making tea sometimes.  It's used by putting tea leaves or coffee grounds in the bottom and putting in, typically  from my experience, would be like cooler water and then you kind of just keep pressing and siphoning the grounds and the tea leaves through the water and then let it soak up and concentrate over time.",0.622442691496312,0.933191473588487
449,tulip024,1,frenchpress," It's like a glass cylindrical pitcher and with the top of it, it's... There's something inside of it that it's like a metal stick that's connected to this flat  circular thing that when you press it, liquid can escape but it'll press down the solid stuff that is in the French press such as coffee and it has a handle on it and you kind of just press it down to remove the coffee grounds from the part of the press that you can pour into a cup. It's used to make coffee. Like you put the coffee grounds in and then the water and then you let it sit and then you press it to remove the liquid from the coffee grounds.",0.604617060163602,0.910449994473275
66,tulip005,1,frenchpress,I'm not entirely sure what this is. I think maybe like metal that you use to iron. I think it's used for ironing clothes to get wrinkles out.,-0.0393670981020786,0.0888716720914227
102,tulip007,1,frenchpress,I have no idea what this is just by the name. I assume it's probably made of metal. I guessing maybe used to press something but can't really guess what's pressing them so.,-0.00161992215776626,0.13702854223944
260,tulip015,1,frenchpress,I think it's made of steel and to help people to work in some factories and actually I'm not pretty sure about what it looks like okay so like what I just said I think it's working in a factory that helps with some big material working,0.141588516840567,0.319730162384939
358,tulip020,1,handmixer,hand mixers are more i'm gonna say used in the kitchen to like help with baking or cooking so it helps like sift the ingredients in a bowl um they're usually metal or plastic and they look like i don't know how to describe how they work i don't know i don't know how i'm supposed to describe them but i'll probably not give you the answer in a moment um so that's look like we have like oh i'm gonna taste some honeyヤあنا that would be look like I think it's used for the kitchen and sifting through,0.432598655046413,0.69099336517421
0,tulip003,1,handmixer,A hand mixer is usually made out of metal and it's to help you mix things around. And it's usually electric most of the time. Okay. You usually plug it in and then you can control the speed for how fast you want it to mix and it's usually used for baking or cooking. Okay.,0.424108058968131,0.680161282439749
214,tulip012,1,handmixer," I think a hand mixer, looks like a whisk but it's got sort of a motor on top which you can...  Which you can press an on button to make it whisk and it's made from metal, plastic.  Yeah. And it works by either turning, either turning it on and off or if it's the mechanical  one doing the lever and it's used for, to make it easier to whisk things such as eggs, mixed smoothies and other foods that need to be mixed like that.",0.412627721013684,0.66551496439616
272,tulip015,1,handmixer,For this one i think it can... It can like help people to working like so it's probably made of hard materials and something like steel and also and you probably have a handle on it and it's pretty long I guess um for this I think that it can help people to working fixing anything or like probably using cooking or agriculture or fixing any mud um fixing anything in your home or something,-0.109028075499262,0
120,tulip008,1,handmixer,"The object typically looks like one big rectangle with a, a handle on it. And it’s got rods that come down, I don’t know what the proper term is. But it’s got rods that come down, and then it’s got whisks and you use that to mix whatever you’re putting in the mixer. The object works by taking those whisks and spinning really fast, and it’s air bubbles in your mixture and it mixes all the ingredients together. . . . . . . . . . . . . . . .",0.193295983362175,0.385697209949969
92,tulip007,1,handmixer,It is mostly made of metal with either like a- it's either fully made of metal or it's fully made of plastic. It's a little more difficult to wash a small sense of like how it is shaped. It is used to mix ingredients together typically either when baking or cooking. When cooking typically like beating eggs or when like baking it would be typically to beat eggs as well or to just ensure the ingredients are well mixed.,0.199824014146177,0.394025502674469
342,tulip019,1,pocketradio,"A pocket radio, I’m going to assume it’s one of the old radios that could clip onto  your shirt or pants depending on what generation it is I'm assuming it has you know buttons on it Aux cord where you could listen in it could have like you know batteries it could it could be shaped like a square it could be big or small I'm assuming it's gonna be a medium at least and yeah how this object works and what is used for I would say it is used for to listen to the radio or any sort of music that's on there might be a dial on it where you could change frequencies it is just used to as whatever if you could plug in their aux if that your phone's ever has our school you could listen in either with just your phones or you could maybe have it does it might be a speaker out and you could just listen outward and yeah Typically it was like an old timey radio. It is like a silver metal box with a large antenna that is used to get the frequencies. It has an FM scale and an AM scale, ranges from 0 to 10. In the back it does have a battery port where you insert batteries just to charge it or power it up. On the side it does have the volume dials. You can increase or lower the volume. The aux cord port. And yeah it does have a little screen but it is only just for you to see the ranges.  And in the middle of it, in the front of the whole pocket radio there is a big speaker that just in a circle. And you can just hear. That is where the volume or that is where the music comes out. How I assume the object works once you insert a battery and you adjust the antenna just to get a good range. You could listen to anything that is on a radio that you could get depending on the scales like zero to 10. You could have it just laying around and just being tuned in on whichever radio station you want. It could be music. It could just be people talking. It could be the news. But yeah it is just a pocket radio and depending on the antenna how good your service is.  Also depends, also determines how clear it is and stuff.",0.582550603783877,0.882298180518425
300,tulip017,1,pocketradio,"A pocket radio is made out of metal or plastic.  It is a very, very small radio that... I guess...  that is portable, I can just carry around in your pocket, just hence the name.  It is used to listen to different channels, usually the news or music.",0.581454588266477,0.880899912286929
284,tulip016,1,pocketradio,"Okay.  From my memory, a pocket radio is a, it's a rectangular device that, um, pocket radio makes me believe that this is a small radio that can fit in the pocket of one's pants. Um. I picture a rectangular gray metal device that has a circular sort of stereo to project sound out of.  Uh, there should be buttons on the rectangular device to change to AM or FM radio.  Uh, on the side there should be a spiral, uh, cylinder to rotate. With your fingers to change volume size.  Uh, I mean, yes, volume size.  And then there should also be some sort of, uh, I'm picturing some sort of like metal wire of some sort at the top of the rectangular device for a connection to radio signals.  And, uh, that's what I think it looks like. Okay.  A pocket radio is basically meant to be a regular radio, which is a device that takes  in radio waves and puts them through a stereo for you to be able to listen to it, projects it outwardly. Uh. And  You can control how loud that is or what station the, what signal the radio is picking  up, uh, based on the buttons and controls on the radio.  For it to be a pocket radio, you'll, you'll be able to fit it in your pocket and that makes it portable.  So it's supposedly a light, small rectangle of some sort.  And then the, the antenna. Or. The wire coming out of the pocket radio is meant to pick up those radio signals.",0.577802607074255,0.876240809197567
12,tulip003,1,pocketradio,This object is usually made out of metal or plastic and it's in the shape of a box. This object works by playing a song or something if a CD was put into it.,0.00595782757688499,0.146696039233762
86,tulip007,1,pocketradio," I'm not really sure what this is, but I would assume that it is made of some form  of metal, maybe like a little plastic, let's say? I guess it's something that's really small for people to bring around to either listen to the radio music or any news.",0.055633913407525,0.210071503886724
